<root xmlns:xsi="http://www.w3.org/2001/XMLSchema-instance" xsi:noNamespaceSchemaLocation="C:\Users\Owner\workspace\OmtgXMLSchema\output\generate_xml_doc\conceptual-model-schema.xsd">
	<db-properties>
		<db-type>oracle-spatial</db-type>
		<database>spatial</database>
		<username>brazil</username>
		<password>xxx</password>
		<port-number>1521</port-number>
		<xml-doc-name>city</xml-doc-name>
	</db-properties>
	<conceptual-model>
		<classes>
			<class>
				<name>rio</name>
				<type>line</type>
				<table-name>rio</table-name>
				<geometry-column>geom</geometry-column>
				<number-of-registers>all</number-of-registers>
				<attributes>
					<attribute>
						<name>id</name>
						<type> int</type>
						<column-name>id</column-name>
					</attribute>
					<attribute>
						<name>name</name>
						<type>string</type>
						<column-name>name</column-name>
					</attribute>
				</attributes>
			</class>
		</classes>
		<relationships>
			<relationship>
				<name>contains</name>
				<distance>100</distance>
				<unit>meter</unit>
				<class1>a</class1>
				<cardinality1>
					<min>0</min>
					<max>n</max>
				</cardinality1>
				<class2>b</class2>
				<cardinality2>
					<min>0</min>
					<max>n</max>
				</cardinality2>
			</relationship>
		</relationships>
	</conceptual-model>
</root>
